{"adapter_bundle":{"name":"dirextalk-knowledge-adapter.tar.gz","sha256":"61ef32ad69a4fed9fbf7444d34358f433dae9cbbb8ff47bc34b6871bad03eeb5","size":43111084,"version":"knowledge-adapter-v1"},"model":{"files":[{"path":"onnx/model.onnx","sha256":"ca456c06b3a9505ddfd9131408916dd79290368331e7d76bb621f1cba6bc8665","size":470268510},{"path":"tokenizer.json","sha256":"0b44a9d7b51c3c62626640cda0e2c2f70fdacdc25bbbd68038369d14ebdf4c39","size":17082730},{"path":"config.json","sha256":"69137736cab8b8903a07fe8afaafdda25aac55415a12a55d1bffa9f581abf959","size":655},{"path":"tokenizer_config.json","sha256":"a1d6bc8734a6f635dc158508bef000f8e2e5a759c7d92f984b2c86e5ff53425b","size":443},{"path":"special_tokens_map.json","sha256":"d05497f1da52c5e09554c0cd874037a083e1dc1b9cfd48034d1c717f1afc07a7","size":167}],"repository":"intfloat/multilingual-e5-small","revision":"0e60b8d9d2166d80387f86e3b48ec9ced55f4d15"},"qdrant":{"name":"qdrant-x86_64-unknown-linux-musl.tar.gz","sha256":"b4faedcdf8c9577bf1c8f2ab9b454636b87e056c116c99d49bd4f9fb2e634285","size":30745357,"version":"1.18.3"},"schema_version":1}
